{
  "schemaVersion": 1,
  "lessonId": "M01-L002",
  "priorLessons": [
    "M01-L001"
  ],
  "knownVocabulary": [
    {
      "thai": "สวัสดี",
      "translit": "sà-wàt-dii",
      "english": "hello",
      "vocabId": "v-c9337e2739"
    },
    {
      "thai": "สวัสดีครับ",
      "translit": "sà-wàt-dii khráp",
      "english": "hello (male speaker)",
      "vocabId": "v-e653eb5319"
    },
    {
      "thai": "สวัสดีค่ะ",
      "translit": "sà-wàt-dii khâ",
      "english": "hello (female speaker)",
      "vocabId": "v-bccbe506b3"
    },
    {
      "thai": "ขอบคุณ",
      "translit": "khàawp-khun",
      "english": "thank you",
      "vocabId": "v-217b46aa5a"
    },
    {
      "thai": "ขอโทษ",
      "translit": "khǎaw-thôot",
      "english": "excuse me / sorry",
      "vocabId": "v-6fce5e8c2c"
    },
    {
      "thai": "ไม่เป็นไร",
      "translit": "mâi bpen rai",
      "english": "it is okay / no problem",
      "vocabId": "v-03cc3fe123"
    },
    {
      "thai": "ครับ",
      "translit": "khráp",
      "english": "male polite ending",
      "vocabId": "v-a34b9ddfd4"
    },
    {
      "thai": "ค่ะ",
      "translit": "khâ",
      "english": "female statement ending",
      "vocabId": "v-e5c357ab24"
    },
    {
      "thai": "คะ",
      "translit": "khá",
      "english": "female question ending",
      "vocabId": "v-8637eb381c"
    },
    {
      "thai": "ใช่",
      "translit": "châi",
      "english": "yes / that is right",
      "vocabId": "v-f40371ec59"
    },
    {
      "thai": "ไม่ใช่",
      "translit": "mâi châi",
      "english": "no / not right",
      "vocabId": "v-cda55f5b5e"
    }
  ],
  "knownGrammar": [
    "Explain what ครับ, ค่ะ, and คะ do so the learner does not memorize them as random decoration.",
    "Give the learner a small response toolkit so a first encounter can continue instead of stopping at one memorised line.",
    "Teach the core greeting and show that politeness is built into the line, not added as an afterthought.",
    "Teach the two highest-value courtesy phrases and explain that one form repairs the interaction while the other closes it warmly."
  ],
  "reviewBuckets": [
    {
      "bucket": "last",
      "offset": 1,
      "lessonId": "M01-L001",
      "vocabIds": [
        "v-c9337e2739",
        "v-e653eb5319",
        "v-bccbe506b3",
        "v-217b46aa5a"
      ],
      "sample": [
        {
          "thai": "สวัสดี",
          "translit": "sà-wàt-dii",
          "english": "hello",
          "vocabId": "v-c9337e2739"
        },
        {
          "thai": "สวัสดีครับ",
          "translit": "sà-wàt-dii khráp",
          "english": "hello (male speaker)",
          "vocabId": "v-e653eb5319"
        },
        {
          "thai": "สวัสดีค่ะ",
          "translit": "sà-wàt-dii khâ",
          "english": "hello (female speaker)",
          "vocabId": "v-bccbe506b3"
        },
        {
          "thai": "ขอบคุณ",
          "translit": "khàawp-khun",
          "english": "thank you",
          "vocabId": "v-217b46aa5a"
        }
      ]
    },
    {
      "bucket": "minus3",
      "offset": 3,
      "lessonId": null,
      "vocabIds": [],
      "sample": []
    },
    {
      "bucket": "minus6",
      "offset": 6,
      "lessonId": null,
      "vocabIds": [],
      "sample": []
    },
    {
      "bucket": "minus8",
      "offset": 8,
      "lessonId": null,
      "vocabIds": [],
      "sample": []
    }
  ]
}
